{
  "protocol": "qsol-lattice-migration/1",
  "migration_id": "v1-additive-metadata-compatibility",
  "source_profile": {
    "protocol": "qsol-lattice-profile-descriptor/1",
    "profile_id": "qsol-3x3x3-sierpinski-derived-memory/1",
    "profile_fingerprint": "sha256:6e7c4a9a781d552a2b561d334a8435c12efe2908fcd24a0f152935aded555bcf"
  },
  "target_profile": {
    "protocol": "qsol-lattice-profile-descriptor/1",
    "profile_id": "qsol-3x3x3-sierpinski-derived-memory/1",
    "profile_fingerprint": "sha256:6e7c4a9a781d552a2b561d334a8435c12efe2908fcd24a0f152935aded555bcf",
    "metadata": {
      "description": "Additive descriptive metadata does not reinterpret address semantics.",
      "consumer_hint": "optional"
    }
  },
  "mode": "identity",
  "preserve_source_identity": true,
  "mappings": [
    {"source_address": "L[0,0,0]", "target_address": "L[0,0,0]"},
    {"source_address": "L[2,0,2]", "target_address": "L[2,0,2]"}
  ],
  "metadata": {
    "reason": "exercise additive-compatible metadata without changing profile meaning"
  }
}
